id	text	en	loc
11962	Definitely not a new toy craze. I had one when I was a kid.	Definitely not a new toy craze. I had one when I was a kid.	Inventory.dinky
11963	It's a celebrity's head, but kind of demeaning being a candy dispenser. I need a better photo.	It's a celebrity's head, but kind of demeaning being a candy dispenser. I need a better photo.	Inventory.dinky
11964	I sure loved these when I was a kid.	I sure loved these when I was a kid.	Inventory.dinky
11965	Ouch!! My tooth!	Ouch!! My tooth!	Inventory.dinky
11966	No way. One broken tooth is enough.	No way. One broken tooth is enough.	Inventory.dinky
11967	^%d specks of dust	^%d specks of dust	Inventory.dinky
11968	^%d specks of dust	^%d specks of dust	Inventory.dinky
11969	I don't think this is enough dust for Natalie.	I don't think this is enough dust for Natalie.	Inventory.dinky
11970	^She probably needs around %d specks of dust.	^She probably needs around %d specks of dust.	Inventory.dinky
11971	That's a good shot!	That's a good shot!	Inventory.dinky
11972	Natalie will love this one!	Natalie will love this one!	Inventory.dinky
11973	This is perfect for the story!	This is perfect for the story!	Inventory.dinky
11974	I have 1 speck of dust.	I have 1 speck of dust.	Inventory.dinky
11975	^I have %d specks of dust.	^I have %d specks of dust.	Inventory.dinky
11976	glass of polluted water	glass of polluted water	Inventory.dinky
11977	glass of water	glass of water	Inventory.dinky
11978	a glass of polluted water	a glass of polluted water	Inventory.dinky
11979	a glass of water	a glass of water	Inventory.dinky
11980	camera	camera	Inventory.dinky
11981	a	a	Inventory.dinky
11982	photo	photo	Inventory.dinky
11983	my assignment	my assignment	Inventory.dinky
11984	electricity bill with stamps	electricity bill with stamps	Inventory.dinky
11985	electricity bill	electricity bill	Inventory.dinky
11986	stamps	stamps	Inventory.dinky
11987	bottle	bottle	Inventory.dinky
11988	nickel	nickel	Inventory.dinky
11989	Fortran book	Fortran book	Inventory.dinky
11990	a Fortran book	a Fortran book	Inventory.dinky
11991	key	key	Inventory.dinky
11992	screwdriver	screwdriver	Inventory.dinky
11993	“Philipp's Dangerous Dövice”	“Philipp's Dangerous Dövice”	Inventory.dinky
11994	ThimbleCon poster	ThimbleCon poster	Inventory.dinky
11995	candy dispenser	candy dispenser	Inventory.dinky
11996	speck of dust	speck of dust	Inventory.dinky
11997	a speck of dust	a speck of dust	Inventory.dinky
11998	Hi there	Hi there	BLANK.yack
11999	Hi back	Hi back	BLANK.yack
12000	Hi Aunt Delores.	Hi Aunt Delores.	Chuckie.yack
12001	Lenore says we're going camping.	Lenore says we're going camping.	Chuckie.yack
12002	Lenore says someday we'll have money again.	Lenore says someday we'll have money again.	Chuckie.yack
12003	That's nice.	That's nice.	Chuckie.yack
12004	Hi Coroner!	Hi Coroner!	Coroner.yack
12005	Hello-a-who Delores.	Hello-a-who Delores.	Coroner.yack
12006	When did you start adding 'a-who' after everything?	When did you start adding 'a-who' after everything?	Coroner.yack
12007	Right there! You just did it again!	Right there! You just did it again!	Coroner.yack
12008	Whatever-a-who.	Whatever-a-who.	Coroner.yack
12009	You and the Sheriff should form a comedy team.	You and the Sheriff should form a comedy team.	Coroner.yack
12010	Not a lot of deaths in Thimbleweed Park, are there?	Not a lot of deaths in Thimbleweed Park, are there?	Coroner.yack
12011	Did I read about someone named Boris being murdered?	Did I read about someone named Boris being murdered?	Coroner.yack
12012	Sheriff wants to see you.	Sheriff wants to see you.	Coroner.yack
12013	Sheriff wants to see you again.	Sheriff wants to see you again.	Coroner.yack
12014	Got to run... bye.	Got to run... bye.	Coroner.yack
12015	Not really.	Not really.	Coroner.yack
12016	I'm not sure why I still have a job.	I'm not sure why I still have a job.	Coroner.yack
12017	I don't understand-a-who what you're talking about!	I don't understand-a-who what you're talking about!	Coroner.yack
12018	Have you been drinking formaldehyde? Trust me, just say-no-a-who.	Have you been drinking formaldehyde? Trust me, just say-no-a-who.	Coroner.yack
12019	Hey, the 'a-who' bit is mine!	Hey, the 'a-who' bit is mine!	Coroner.yack
12020	Ha! Got ya!	Ha! Got ya!	Coroner.yack
12021	You two could open for Ransome the Clown.	You two could open for Ransome the Clown.	Coroner.yack
12022	I'll talk to him-a-who about it.	I'll talk to him-a-who about it.	Coroner.yack
12023	I have some great material about extracting a brain.	I have some great material about extracting a brain.	Coroner.yack
12024	I bet you do.	I bet you do.	Coroner.yack
12025	What-a-who!	What-a-who!	Coroner.yack
12026	Where did you read that? We've never had a murder in Thimbleweed Park, and I don't know anyone named Boris.	Where did you read that? We've never had a murder in Thimbleweed Park, and I don't know anyone named Boris.	Coroner.yack
12027	I read it in your confidential coroner files.	I read it in your confidential coroner files.	Coroner.yack
12028	I read it in that trash-rag the Nickel News.	I read it in that trash-rag the Nickel News.	Coroner.yack
12029	I read it on an on-line BBS.	I read it on an on-line BBS.	Coroner.yack
12030	I don't know. I can't remember.	I don't know. I can't remember.	Coroner.yack
12031	Really? Me-a-who? That's exciting.	Really? Me-a-who? That's exciting.	Coroner.yack
12032	Hi there, Dave.	Hi there, Dave.	Dave.yack
12033	Hi Delores. Welcome back!	Hi Delores. Welcome back!	Dave.yack
12034	Can't talk. Busy!	Can't talk. Busy!	Dave.yack
12035	Hi Lenore.	Hi Lenore.	Lenore.yack
12036	What are you doing here? Hanging out by a burning trash can like a bum.	What are you doing here? Hanging out by a burning trash can like a bum.	Lenore.yack
12037	Oh enough with the wise-cracks and “I'm so much better than you” remarks.	Oh enough with the wise-cracks and “I'm so much better than you” remarks.	Lenore.yack
12038	I wasn't mocking you, it was a real...	I wasn't mocking you, it was a real...	Lenore.yack
12039	This is all your doing.	This is all your doing.	Lenore.yack
12040	What is all my doing?	What is all my doing?	Lenore.yack
12041	We're sisters, can't we be friends?	We're sisters, can't we be friends?	Lenore.yack
12042	I suddenly have a craving for s'mores.	I suddenly have a craving for s'mores.	Lenore.yack
12043	Enough with the wise-cracks!	Enough with the wise-cracks!	Lenore.yack
12044	If you'd left Uncle Chuck in the computer, he would have died and I'd have gotten my inheritance.	If you'd left Uncle Chuck in the computer, he would have died and I'd have gotten my inheritance.	Lenore.yack
12045	But he's still alive and in a sanitarium and legally out-of-reach.	But he's still alive and in a sanitarium and legally out-of-reach.	Lenore.yack
12046	You got evicted from the Mansion mansion?	You got evicted from the Mansion mansion?	Lenore.yack
12047	You have no place to go?	You have no place to go?	Lenore.yack
12048	You could bunk with me?	You could bunk with me?	Lenore.yack
12049	I have a photo that shows a job opening at the bank.	I have a photo that shows a job opening at the bank.	Lenore.yack
12050	I have a photo that shows a job opening at the bank.	I have a photo that shows a job opening at the bank.	Lenore.yack
12051	There is a job opening at the bank.	There is a job opening at the bank.	Lenore.yack
12052	Have you tried to get a job?	Have you tried to get a job?	Lenore.yack
12053	I thought you loved little Chuckie?	I thought you loved little Chuckie?	Lenore.yack
12054	Nice weather.	Nice weather.	Lenore.yack
12055	Seen the new Ransome show yet?	Seen the new Ransome show yet?	Lenore.yack
12056	See ya around, sis.	See ya around, sis.	Lenore.yack
12057	Get lost.	Get lost.	Lenore.yack
12058	Yes!	Yes!	Lenore.yack
12059	If you hadn't been so preoccupied with making murder simulators, you'd have known.	If you hadn't been so preoccupied with making murder simulators, you'd have known.	Lenore.yack
12060	The bank repossessed the Edmund Mansion mansion and evicted me and the little brat and my worthless husband Peter.	The bank repossessed the Edmund Mansion mansion and evicted me and the little brat and my worthless husband Peter.	Lenore.yack
12061	Hey.	Hey.	Lenore.yack
12062	All I got to take was that crappy chair from the library.	All I got to take was that crappy chair from the library.	Lenore.yack
12063	None! I've been blacklisted by all the high society places in the tri-county area.	None! I've been blacklisted by all the high society places in the tri-county area.	Lenore.yack
12064	I named him after Uncle Chuck and everything...	I named him after Uncle Chuck and everything...	Lenore.yack
12065	...what good did it do?	...what good did it do?	Lenore.yack
12066	Nothing! Evicted!	Nothing! Evicted!	Lenore.yack
12067	Sure! Me and all your nerdy friends can play D&E together.	Sure! Me and all your nerdy friends can play D&E together.	Lenore.yack
12068	We're not nerds!	We're not nerds!	Lenore.yack
12069	It's called D&D. For Dungeons and Dragons.	It's called D&D. For Dungeons and Dragons.	Lenore.yack
12070	We're not nerds!	We're not nerds!	Lenore.yack
12071	I'm thinking you play chaotic evil?	I'm thinking you play chaotic evil?	Lenore.yack
12072	We're not nerds!	We're not nerds!	Lenore.yack
12073	Love you too sis.	Love you too sis.	Lenore.yack
12074	Bank teller?	Bank teller?	Lenore.yack
12075	You've got to be kidding! An Edmund from the prestigious Thimbleweed Edmunds taking a teller job?	You've got to be kidding! An Edmund from the prestigious Thimbleweed Edmunds taking a teller job?	Lenore.yack
12076	Even if I was to stoop that low, I don't believe you.	Even if I was to stoop that low, I don't believe you.	Lenore.yack
12077	Like what!?!	Like what!?!	Lenore.yack
12078	Barista. I hear it's going to be big.	Barista. I hear it's going to be big.	Lenore.yack
12079	NASA Space Shuttle mission specialist?	NASA Space Shuttle mission specialist?	Lenore.yack
12080	Streetwalker?	Streetwalker?	Lenore.yack
12081	Weekend waitress at the S&D Diner?	Weekend waitress at the S&D Diner?	Lenore.yack
12082	Bank teller?	Bank teller?	Lenore.yack
12083	Ransome the Clown show ticket taker.	Ransome the Clown show ticket taker.	Lenore.yack
12084	Yeah, that's an interesting...	Yeah, that's an interesting...	Lenore.yack
12085	NO IT'S NOT!	NO IT'S NOT!	Lenore.yack
12086	Edmunds don't work!	Edmunds don't work!	Lenore.yack
12087	That's why you're such a disgrace to the family name.	That's why you're such a disgrace to the family name.	Lenore.yack
12088	What?  You're showing me a job opening? You think I need a job! Like a common person!	What?  You're showing me a job opening? You think I need a job! Like a common person!	Lenore.yack
12089	Well... I never... Yeah... I'll... I... I might stop by...	Well... I never... Yeah... I'll... I... I might stop by...	Lenore.yack
12090	A job opening? Well... I never... Yeah... I'll... I... I might stop by...	A job opening? Well... I never... Yeah... I'll... I... I might stop by...	Lenore.yack
12091	Yeah, you already showed me that! I'll think about it.	Yeah, you already showed me that! I'll think about it.	Lenore.yack
12092	Interesting... Yeah... Maybe I'll... No... I... I might stop by... Might.	Interesting... Yeah... Maybe I'll... No... I... I might stop by... Might.	Lenore.yack
12093	Yeah, you already said that! I'll think about it.	Yeah, you already said that! I'll think about it.	Lenore.yack
12094	Oh my! It is the best!	Oh my! It is the best!	Lenore.yack
12095	Seeing Ransome is the only joy left in my life.	Seeing Ransome is the only joy left in my life.	Lenore.yack
12096	Hi Lenore.	Hi Lenore.	Lenore.yack
12097	Congrats on the new job!	Congrats on the new job!	Lenore.yack
12098	Shhhhh... don't say my name out loud. Someone might hear.	Shhhhh... don't say my name out loud. Someone might hear.	Lenore.yack
12099	I hear.	I hear.	Lenore.yack
12100	Can you check my bank balance?	Can you check my bank balance?	Lenore.yack
12101	Can you check my bank balance again?	Can you check my bank balance again?	Lenore.yack
12102	Nice weather.	Nice weather.	Lenore.yack
12103	So...	So...	Lenore.yack
12104	How is Chuckie?	How is Chuckie?	Lenore.yack
12105	Goodbye and thanks.	Goodbye and thanks.	Lenore.yack
12106	Let me see...	Let me see...	Lenore.yack
12107	You have...	You have...	Lenore.yack
12108	NOTHING!	NOTHING!	Lenore.yack
12109	Zip squat!	Zip squat!	Lenore.yack
12110	Zero dollars and zero cents.	Zero dollars and zero cents.	Lenore.yack
12111	Nada!	Nada!	Lenore.yack
12112	A big zero point zero zero dollars.	A big zero point zero zero dollars.	Lenore.yack
12113	Like I care anymore.	Like I care anymore.	Lenore.yack
12114	About anything...	About anything...	Lenore.yack
12115	Good and bad news about the Mansion mansion... never mind.	Good and bad news about the Mansion mansion... never mind.	Lenore.yack
12116	Who cares.	Who cares.	Lenore.yack
12117	Get lost.	Get lost.	Lenore.yack
12118	What's up D!	What's up D!	Leonard.yack
12119	What's up Delores!	What's up Delores!	Leonard.yack
12120	Thanks for mailing that letter.	Thanks for mailing that letter.	Leonard.yack
12121	Don't call me D.	Don't call me D.	Leonard.yack
12122	Hey Leonard.	Hey Leonard.	Leonard.yack
12123	Bathroom light switch doesn't work.	Bathroom light switch doesn't work.	Leonard.yack
12124	Bathroom light switch still doesn't work.	Bathroom light switch still doesn't work.	Leonard.yack
12125	See ya!	See ya!	Leonard.yack
12126	OK, sure thing D... I mean Delores.	OK, sure thing D... I mean Delores.	Leonard.yack
12127	Hey back at ya!	Hey back at ya!	Leonard.yack
12128	Yeah. About that.	Yeah. About that.	Leonard.yack
12129	Management forgot to pay the power bill, so they cut power to the bathroom.	Management forgot to pay the power bill, so they cut power to the bathroom.	Leonard.yack
12130	If it doesn't get paid soon, the whole building will lose power, man.	If it doesn't get paid soon, the whole building will lose power, man.	Leonard.yack
12131	Did management forget, or did you forget to mail the payment?	Did management forget, or did you forget to mail the payment?	Leonard.yack
12132	I don't think this is the time to be pointing fingers!	I don't think this is the time to be pointing fingers!	Leonard.yack
12133	Here is the payment, can you drop it in a mailbox for me... I mean management?	Here is the payment, can you drop it in a mailbox for me... I mean management?	Leonard.yack
12134	Sure.	Sure.	Leonard.yack
12135	Management forgot to pay the power bill I gave you.	Management forgot to pay the power bill I gave you.	Leonard.yack
12136	If it doesn't get paid soon, the whole building will lose power, man.	If it doesn't get paid soon, the whole building will lose power, man.	Leonard.yack
12137	Can you drop the payment in a mailbox for me... I mean management?	Can you drop the payment in a mailbox for me... I mean management?	Leonard.yack
12138	Sure.	Sure.	Leonard.yack
12139	Hello Madame Morena.	Hello Madame Morena.	Morena.yack
12140	How have things been?	How have things been?	Morena.yack
12141	Got any eye-of-newt?	Got any eye-of-newt?	Morena.yack
12142	Yes, I see.	Yes, I see.	Morena.yack
12143	Yes, I really see.	Yes, I really see.	Morena.yack
12144	I really really see!	I really really see!	Morena.yack
12145	I can see!	I can see!	Morena.yack
12146	But I can see.	But I can see.	Morena.yack
12147	Ok fine, I can't see.	Ok fine, I can't see.	Morena.yack
12148	*sigh*	*sigh*	Morena.yack
12149	Have you heard about the circus being abandoned? 	Have you heard about the circus being abandoned? 	Morena.yack
12150	Seen Ransome the Clown's latest show yet?	Seen Ransome the Clown's latest show yet?	Morena.yack
12151	You noticed anything odd?	You noticed anything odd?	Morena.yack
12152	Sign out front says you're having a blow-out sale.	Sign out front says you're having a blow-out sale.	Morena.yack
12153	See ya!	See ya!	Morena.yack
12154	Been a while since I've seen you around, Delores.	Been a while since I've seen you around, Delores.	Morena.yack
12155	That game designer job has kept me pretty busy.	That game designer job has kept me pretty busy.	Morena.yack
12156	I'm on my post-crunch vacation, helping Natalie out.	I'm on my post-crunch vacation, helping Natalie out.	Morena.yack
12157	Yes! It's his best show yet. I go every week.	Yes! It's his best show yet. I go every week.	Morena.yack
12158	I hope to see it before I leave.	I hope to see it before I leave.	Morena.yack
12159	Nothing...	Nothing...	Morena.yack
12160	...And you should leave well enough alone my dear.	...And you should leave well enough alone my dear.	Morena.yack
12161	Only misery lies down that path of thought.	Only misery lies down that path of thought.	Morena.yack
12162	Besides, I don't know what I'd do without my weekly hit of Ransome!	Besides, I don't know what I'd do without my weekly hit of Ransome!	Morena.yack
12163	Please!	Please!	Morena.yack
12164	Eye of Newt is right out of the back of comic books!	Eye of Newt is right out of the back of comic books!	Morena.yack
12165	It's not real magic.	It's not real magic.	Morena.yack
12166	I see.	I see.	Morena.yack
12167	Do you see?	Do you see?	Morena.yack
12168	Do you really see?	Do you really see?	Morena.yack
12169	Do you really really see?	Do you really really see?	Morena.yack
12170	I don't think you see.	I don't think you see.	Morena.yack
12171	I wish you could see.	I wish you could see.	Morena.yack
12172	I don't think you can see.	I don't think you can see.	Morena.yack
12173	I told you, you can't see.	I told you, you can't see.	Morena.yack
12174	In the last day I've noticed some odd ripples in the fabric of reality.	In the last day I've noticed some odd ripples in the fabric of reality.	Morena.yack
12175	If I believed that mumbo-jumbo, that would sound scary.	If I believed that mumbo-jumbo, that would sound scary.	Morena.yack
12176	BELIEVE!	BELIEVE!	Morena.yack
12177	Scary forces are at work.	Scary forces are at work.	Morena.yack
12178	Many years ago, there was a tear that has gone unnoticed until a few days ago.	Many years ago, there was a tear that has gone unnoticed until a few days ago.	Morena.yack
12179	I fear you might be connected.	I fear you might be connected.	Morena.yack
12180	Take a chill-pill.	Take a chill-pill.	Morena.yack
12181	And maybe some breath mints.	And maybe some breath mints.	Morena.yack
12182	Got any books on Fortran?	Got any books on Fortran?	Morena.yack
12183	Might be one at the very top.	Might be one at the very top.	Morena.yack
12184	If you find it, you can take it.	If you find it, you can take it.	Morena.yack
12185	The only dead languages we need books on is ancient capsipan.	The only dead languages we need books on is ancient capsipan.	Morena.yack
12186	I'm excited about my new job!	I'm excited about my new job!	Natalie.yack
12187	Natalie has hired me to be the Nickel News photographer.	Natalie has hired me to be the Nickel News photographer.	Natalie.yack
12188	I can't wait to get started!	I can't wait to get started!	Natalie.yack
12189	Another exciting assignment as the Nickel News photographer!	Another exciting assignment as the Nickel News photographer!	Natalie.yack
12190	I wonder what Natalie has for me now?	I wonder what Natalie has for me now?	Natalie.yack
12191	My, aren't we the eager beaver this morning.	My, aren't we the eager beaver this morning.	Natalie.yack
12192	I'm excited to get started!	I'm excited to get started!	Natalie.yack
12193	It will be a nice creative break from making games.	It will be a nice creative break from making games.	Natalie.yack
12194	It's not really the morning, it's just after 5pm.	It's not really the morning, it's just after 5pm.	Natalie.yack
12195	Interesting.	Interesting.	Natalie.yack
12196	I'm working on several stories for upcoming editions of the Thimbleweed Nickel, and we need photographs.	I'm working on several stories for upcoming editions of the Thimbleweed Nickel, and we need photographs.	Natalie.yack
12197	I've made a list for you, and the camera is in the file cabinet by the door.	I've made a list for you, and the camera is in the file cabinet by the door.	Natalie.yack
12198	Let me know if you need anything. More film, office supplies, info on your 401k.	Let me know if you need anything. More film, office supplies, info on your 401k.	Natalie.yack
12199	Good luck on your first day as a photojournalist.	Good luck on your first day as a photojournalist.	Natalie.yack
12200	Photojournalist! That makes it sound important!	Photojournalist! That makes it sound important!	Natalie.yack
12201	^You need to turn in %d more photos before returning to your game developer job at MMucasFlem.	^You need to turn in %d more photos before returning to your game developer job at MMucasFlem.	Natalie.yack
12202	I better find that camera, take a look at the list, and get cracking.	I better find that camera, take a look at the list, and get cracking.	Natalie.yack
12203	Still working on those photos.	Still working on those photos.	Natalie.yack
12204	Where did you say the camera was again?	Where did you say the camera was again?	Natalie.yack
12205	I think I'm done with the assignment.	I think I'm done with the assignment.	Natalie.yack
12206	Can I get some more film?	Can I get some more film?	Natalie.yack
12207	Want to see my work so far?	Want to see my work so far?	Natalie.yack
12208	How long will this assignment last?	How long will this assignment last?	Natalie.yack
12209	Can I get some office supplies?	Can I get some office supplies?	Natalie.yack
12210	What can you tell me about my 401k?	What can you tell me about my 401k?	Natalie.yack
12211	Never mind... bye.	Never mind... bye.	Natalie.yack
12212	Look in the filing cabinet by the door.	Look in the filing cabinet by the door.	Natalie.yack
12213	You need to turn in 1 more original photo.	You need to turn in 1 more original photo.	Natalie.yack
12214	^You need to turn in %d more original photos.	^You need to turn in %d more original photos.	Natalie.yack
12215	Then it's back to making games at MMucasFlem for me.	Then it's back to making games at MMucasFlem for me.	Natalie.yack
12216	Looks like you've got plenty.	Looks like you've got plenty.	Natalie.yack
12217	Here is a couple more.	Here is a couple more.	Natalie.yack
12218	I need some paper clips!	I need some paper clips!	Natalie.yack
12219	I need some manila folders.	I need some manila folders.	Natalie.yack
12220	I need some stamps.	I need some stamps.	Natalie.yack
12221	I need some no. 2 pencils.	I need some no. 2 pencils.	Natalie.yack
12222	I need some whiteout.	I need some whiteout.	Natalie.yack
12223	Sorry, I actually don't need anything right now.	Sorry, I actually don't need anything right now.	Natalie.yack
12224	I have a letter that needs mailing. Might be important to my assignment.	I have a letter that needs mailing. Might be important to my assignment.	Natalie.yack
12225	Okay.	Okay.	Natalie.yack
12226	Best path to retirement as a journalist is to get another job.	Best path to retirement as a journalist is to get another job.	Natalie.yack
12227	Kind of like game development.	Kind of like game development.	Natalie.yack
12228	No you don't.	No you don't.	Natalie.yack
12229	These look great!	These look great!	Natalie.yack
12230	The prototype is now over.	The prototype is now over.	Natalie.yack
12231	Do I get a raise?	Do I get a raise?	Natalie.yack
12232	Do I get a promotion?	Do I get a promotion?	Natalie.yack
12233	Do I get to keep wandering around?	Do I get to keep wandering around?	Natalie.yack
12234	Can I quit the game?	Can I quit the game?	Natalie.yack
12235	Nope.	Nope.	Natalie.yack
12236	Ok.	Ok.	Natalie.yack
12237	Play again and I'll have more photos for you to take.	Play again and I'll have more photos for you to take.	Natalie.yack
12238	I think you're done here, Delores.	I think you're done here, Delores.	Natalie.yack
12239	By the way...	By the way...	Natalie.yack
12240	Do you know anything about the body they found under the bridge?	Do you know anything about the body they found under the bridge?	Natalie.yack
12241	We've got a deadline, so no dilly-dallying.	We've got a deadline, so no dilly-dallying.	Natalie.yack
12242	Welcome to the S&D Diner, Delores!	Welcome to the S&D Diner, Delores!	Sandy.yack
12243	Long time since I've seen you here.	Long time since I've seen you here.	Sandy.yack
12244	Can't talk right now, things are crazy in the kitchen!	Can't talk right now, things are crazy in the kitchen!	Sandy.yack
12245	Welcome back, Delores!	Welcome back, Delores!	Sandy.yack
12246	What can I do for ya?	What can I do for ya?	Sandy.yack
12247	How has life been treating you, Sandy?	How has life been treating you, Sandy?	Sandy.yack
12248	You seen Ransome lately?	You seen Ransome lately?	Sandy.yack
12249	I'm starving. What are your specials today?	I'm starving. What are your specials today?	Sandy.yack
12250	See ya!	See ya!	Sandy.yack
12251	Can't complain. Dave and I just came back from our third honeymoon.	Can't complain. Dave and I just came back from our third honeymoon.	Sandy.yack
12252	You talking about me?	You talking about me?	Sandy.yack
12253	Yes, snuggle cakes, who else would I be talking about?	Yes, snuggle cakes, who else would I be talking about?	Sandy.yack
12254	Ah, love muffin.	Ah, love muffin.	Sandy.yack
12255	Dave and I see his show every Saturday on our date-night.	Dave and I see his show every Saturday on our date-night.	Sandy.yack
12256	He never fails to make us laugh. Such a good guy.	He never fails to make us laugh. Such a good guy.	Sandy.yack
12257	Everything is on the menu board, what do you want?	Everything is on the menu board, what do you want?	Sandy.yack
12258	I'll have a Kobe beef hot dog.	I'll have a Kobe beef hot dog.	Sandy.yack
12259	I'll have a Swiss pork hot dog.	I'll have a Swiss pork hot dog.	Sandy.yack
12260	I'll have a herb and chicken hot dog.	I'll have a herb and chicken hot dog.	Sandy.yack
12261	I'll have a French mustard and kale veggie dog.	I'll have a French mustard and kale veggie dog.	Sandy.yack
